{
  "schema": "rumiga.change-record.v1",
  "task_id": "M1-002",
  "title": "Make stock CPU profiles portable",
  "status": "verified",
  "summary": "Make the active m68k CPU and complete rumiga-core graph compile under no_std plus alloc for bare-metal 32-bit RISC-V while isolating the host-only FPU implementation.",
  "scope": [
    "m68k runtime feature contract",
    "Allocator-backed disassembler boundary",
    "Host-only FPU feature isolation",
    "rumiga-core dependency feature forwarding",
    "Declarative RISC-V portable profiles",
    "Host and target feature-matrix enforcement"
  ],
  "risk": {
    "level": "high",
    "failure_mode": "Cargo feature unification or incorrect F-line fallback could reintroduce std into firmware builds or change stock CPU exception behavior.",
    "rollback": "Revert the M1-002 CPU, core feature forwarding, portable profile, CI, and documentation commits together to restore the previous host-only CPU graph."
  },
  "compatibility": {
    "status": "affected",
    "detail": "Default desktop consumers retain std and FPU behavior; consumers disabling m68k defaults must now select exactly one runtime profile, and FPU remains unavailable under no_std."
  },
  "security": {
    "status": "none",
    "detail": "No network, credential, authorization, media, persistence, unsafe-code, or FFI policy changes."
  },
  "tests": [
    {
      "id": "m68k-no-std-riscv-release",
      "command": "cargo +1.97.1 check --locked --release -p m68k --target riscv32imafc-unknown-none-elf --no-default-features --features no_std",
      "proves": "The active integer CPU implementation compiles without std as an optimized bare-metal 32-bit RISC-V artifact."
    },
    {
      "id": "core-no-std-riscv-release",
      "command": "cargo +1.97.1 check --locked --release -p rumiga-core --target riscv32imafc-unknown-none-elf --no-default-features --features no_std",
      "proves": "The complete stock Amiga core dependency graph, including m68k, compiles for the pinned bare-metal target."
    },
    {
      "id": "m68k-feature-matrix",
      "command": "cargo +1.97.1 xtask ci --gate host",
      "proves": "Valid std and no_std CPU profiles pass, invalid combinations fail with stable diagnostics, Line-F fallback is preserved, and the default FPU-enabled workspace remains green."
    },
    {
      "id": "portable-profile-gate",
      "command": "cargo +1.97.1 xtask ci --gate portable",
      "proves": "Repository-owned declarative profiles enforce the foundation and optimized stock-core RISC-V builds."
    }
  ],
  "evidence": [
    {
      "id": "hosted-stock-core-portability",
      "kind": "ci-artifact",
      "location": "GitHub Actions PR run 31955508417 final attempt: portable job 95186193261, Linux job 95186193077, macOS job 95186193298, firmware job 95186203507, and aggregate job 95186299985 passed; governance artifact 9265830160 for clean merge revision 114f73b9962372832603424ab4620ddb7bbeee43 has digest sha256:c3c392ae6c7fe20d3e4e001b013f2b25f9fb337eb0fa9da2114ffb2d28a69208. Final main run 31955947410: portable job 95186495955, commit-policy job 95186495962, Linux job 95186496046, macOS job 95186496057, firmware job 95186496064, and aggregate job 95187164742 passed; governance artifact 9265939161 for clean revision 0e07e17028bd249ec44c5c4d1ca87feace4a2dba has digest sha256:ea3b1043d8b54a0dded2a5d61764ca77c0547398029869367c0ba04d1ef6113d",
      "proves": "Linux, macOS, bare-metal RISC-V, governance, and the strict aggregate validate the promoted CPU portability contract from clean revisions."
    }
  ],
  "documentation": [
    "ARCHITECTURE.md",
    "CI.md",
    "IMPLEMENTATION_PLAN.md",
    "PROJECT_STATUS.md",
    "README.md",
    "ROADMAP.md",
    "crates/m68k/README.md",
    "crates/rumiga-core/src/lib.rs",
    "docs/release-notes/unreleased/M1-001.md",
    "docs/adr/README.md"
  ],
  "release_note": "docs/release-notes/unreleased/M1-002.md",
  "architecture_decisions": [
    "docs/adr/0004-stock-cpu-portability.md"
  ]
}
