{
  "schema": "rumiga.change-record.v1",
  "task_id": "M1-001",
  "title": "Define explicit core runtime profiles",
  "status": "verified",
  "summary": "Add mutually exclusive std and no_std runtime profiles to rumiga-core and enforce their valid and invalid configurations in the canonical host gate.",
  "scope": [
    "rumiga-core Cargo feature contract",
    "Core and alloc collection boundary",
    "Host-only trace and blitter services",
    "Dual-profile lint and test enforcement",
    "Runtime profile architecture documentation"
  ],
  "risk": {
    "level": "medium",
    "failure_mode": "Feature drift could compile host services into the portable profile or change default desktop behavior.",
    "rollback": "Revert the M1-001 core, CI, and documentation commits together to restore the previous unconditional std profile."
  },
  "compatibility": {
    "status": "affected",
    "detail": "The default desktop profile is unchanged; consumers disabling default features must now explicitly select no_std, where file tracing is unavailable and blits execute synchronously."
  },
  "security": {
    "status": "none",
    "detail": "No network, credential, authorization, media, or persistence policy changes."
  },
  "tests": [
    {
      "id": "core-explicit-std-profile",
      "command": "cargo +1.97.1 check --locked -p rumiga-core --no-default-features --features std",
      "proves": "The desktop-compatible runtime profile compiles when selected explicitly."
    },
    {
      "id": "core-no-std-profile",
      "command": "cargo +1.97.1 test --locked -p rumiga-core --no-default-features --features no_std",
      "proves": "The allocator-backed core source profile compiles and passes its unit, integration, and golden-vector tests without the std feature."
    },
    {
      "id": "core-feature-matrix-gate",
      "command": "cargo +1.97.1 xtask ci --gate host",
      "proves": "Both valid profiles pass, neither and both are rejected with stable diagnostics, and the default workspace behavior remains green."
    }
  ],
  "evidence": [
    {
      "id": "hosted-core-feature-matrix",
      "kind": "ci-artifact",
      "location": "GitHub Actions run 31934749529 for branch head f538f0ba811691703dd88b1c75d7cceaa5dc8676; Linux job 95134810493 and macOS job 95134810516 passed; artifact 9260313104 governance-aab85a06bd8c893397b5e9ac719c77863628c5a1 digest sha256:e59760be76a9b1be3599fed1dc8300c08c64ed667c13506d224a122e7042c7b6",
      "proves": "The core feature contract composes with the complete host baseline on both supported development platforms."
    }
  ],
  "documentation": [
    "ARCHITECTURE.md",
    "CI.md",
    "IMPLEMENTATION_PLAN.md",
    "PROJECT_STATUS.md",
    "README.md",
    "ROADMAP.md",
    "docs/adr/README.md"
  ],
  "release_note": "docs/release-notes/unreleased/M1-001.md",
  "architecture_decisions": [
    "docs/adr/0002-core-runtime-feature-model.md"
  ]
}
